[
  {
    "action": "sso_action",
    "name": "Sign In",
    "type": "button",
    "scope": "asset",
    "description": "Sign in into the service by clicking at this button",
    "id": "ACT-000-000-001",
    "events": {
      "created": {
        "at": "2020-08-21T09:26:23+00:00"
      },
      "updated": {
        "at": "2020-08-21T09:26:23+00:00"
      }
    },
    "title": "Sign In"
  }
]